{
  "id": "event-thread-stolen-relic",
  "type": "event",
  "title": "Stolen Reliquary",
  "summary": "Someone swapped a chapel relic and left behind fresh ritual wax.",
  "status": "available",
  "eventType": "hook-progressed",
  "notes": "An empty reliquary was recovered with fresh wax seals.\n\nGM truth: The stolen relic is the final focus item for the Cinder Choir's harbor rite.\n\nLegacy thread state: active.\n\nLegacy timeline anchor: future_possible.\n\nImported from legacy thread thread-stolen-relic.",
  "relations": [
    {
      "type": "occursAt",
      "targetId": "location-entity-ruined-chapel"
    },
    {
      "type": "belongsTo",
      "targetId": "effect-pattern-ash-ritual"
    }
  ],
  "createdEffectIds": []
}
