{
  "id": "event-thread-test-84",
  "type": "event",
  "title": "Test Threat 84",
  "summary": "Test threat 84 keeps pressure on the board for layout checks.",
  "status": "available",
  "eventType": "clue-found",
  "notes": "Pressure note 84 needs attention.\n\nGM truth: Threat 84 is part of the seeded stress campaign used to inspect board density.\n\nLegacy thread state: active.\n\nLegacy timeline anchor: future_possible.\n\nImported from legacy thread thread-test-84.",
  "relations": [
    {
      "type": "occursAt",
      "targetId": "location-entity-zone-6"
    },
    {
      "type": "involves",
      "targetId": "location-entity-pattern-anchor-4"
    }
  ],
  "createdEffectIds": []
}
