{
  "id": "event-thread-test-55",
  "type": "event",
  "title": "Test Threat 55",
  "summary": "Test threat 55 keeps pressure on the board for layout checks.",
  "status": "archived",
  "eventType": "consequence-triggered",
  "notes": "GM truth: Threat 55 is part of the seeded stress campaign used to inspect board density.\n\nLegacy thread state: escalated.\n\nLegacy timeline anchor: past.\n\nImported from legacy thread thread-test-55.",
  "relations": [
    {
      "type": "occursAt",
      "targetId": "location-entity-zone-1"
    },
    {
      "type": "involves",
      "targetId": "location-entity-pattern-anchor-2"
    }
  ],
  "createdEffectIds": []
}
