{
  "id": "event-thread-test-83",
  "type": "event",
  "title": "Test Threat 83",
  "summary": "Test threat 83 keeps pressure on the board for layout checks.",
  "status": "active",
  "eventType": "consequence-triggered",
  "notes": "GM truth: Threat 83 is part of the seeded stress campaign used to inspect board density.\n\nLegacy thread state: active.\n\nLegacy timeline anchor: now.\n\nImported from legacy thread thread-test-83.",
  "relations": [
    {
      "type": "occursAt",
      "targetId": "location-entity-zone-5"
    },
    {
      "type": "involves",
      "targetId": "location-entity-pattern-anchor-5"
    }
  ],
  "createdEffectIds": []
}
