{
  "id": "event-now-project-2",
  "type": "event",
  "title": "Current moment",
  "summary": "Signal towers are flickering out of sync, and every village is blaming a different enemy.",
  "status": "active",
  "eventType": "consequence-triggered",
  "notes": "GM truth: A surviving war engine buried in the hills is hijacking the old beacon network to lure militias into conflict.\n\nShadow-generated from now.json.",
  "relations": [],
  "createdEffectIds": []
}
